159,159,139000000.0,Fantasy Action,557,loss of lover spider thanksgiving bad boss hostility,en,Spider-Man,82.502566,"Columbia Pictures, Marvel Enterprises",United States of America,2002-05-01,821708551,121.0,English,Released,With great power comes great responsibility.,spider-man,6.8,5265,Tobey Maguire Willem Dafoe Kirsten Dunst James Franco Cliff Robertson,Sam Raimi,161,Color,Sam Raimi,291.0,121.0,0.0,4000.0,James Franco,24000.0,403706375.0,J.K. Simmons,544665,40484,Kirsten Dunst,0.0,2012.0,English,USA,PG-13,139000000.0,2002.0,11000.0,7.3,1.85,5000,"Action,Adventure,Fantasy,Romance",93,"Action,Adventure,Sci-Fi",121.0,93,"After being bitten by a genetically-modified spider, a shy teenager gains spider-like abilities that he uses to fight injustice as a masked superhero and face a vengeful enemy.",2002,Sony Pictures Entertainment (SPE),139000000.0,114844116.0,407022860,418002176,825025036,2002/5/3,2 hr 1 min,PG-13,121
160,160,145000000.0,Fantasy Action Adventure Animation Comedy,82702,father son relationship wife husband relationship sacrifice viking sequel,en,How to Train Your Dragon 2,100.21391,"DreamWorks Animation, Mad Hatter Entertainment",United States of America,2014-06-12,609123048,102.0,English,Released,The training is over.,how to train your dragon 2,7.6,3106,Jay Baruchel Gerard Butler Kristen Wiig Jonah Hill Cate Blanchett,Dean DeBlois,162,Color,Dean DeBlois,292.0,102.0,255.0,953.0,Djimon Hounsou,18000.0,176997107.0,Gerard Butler,221128,23378,America Ferrera,5.0,343.0,English,USA,PG,145000000.0,2014.0,3000.0,7.9,2.35,46000,"Action,Adventure,Animation,Comedy,Family,Fantasy",174,"Action,Adventure,Animation,Comedy,Family,Fantasy",102.0,174,"When Hiccup and Toothless discover an ice cave that is home to hundreds of new wild dragons and the mysterious Dragon Rider, the two friends find themselves at the center of a battle to protect the peace.",2014,Twentieth Century Fox,145000000.0,49451322.0,177002924,444534595,621537519,2014/6/5,1 hr 42 min,PG,102
163,163,130000000.0,Action Mystery Science Fiction,13183,dc comics secret identity mass murder retirement based on comic book,en,Watchmen,64.798873,"Paramount Pictures, DC Comics, Lawrence Gordon Productions, Legendary Pictures, Warner Bros., Cruel and Unusual Films",United States of America,2009-03-05,185258983,163.0,English,Released,Justice is coming to all of us.  No matter what we do.,watchmen,7.0,2811,Malin \u00c5kerman Billy Crudup Carla Gugino Jeffrey Dean Morgan Patrick Wilson,Zack Snyder,165,Color,Zack Snyder,451.0,215.0,0.0,413.0,Billy Crudup,986.0,107503316.0,Matt Frewer,392474,2530,Stephen McHattie,1.0,1229.0,English,USA,R,130000000.0,2009.0,745.0,7.7,2.35,18000,"Action,Drama,Mystery,Sci-Fi",963,"Action,Drama,Mystery,Sci-Fi",162.0,963,"In 1985 where former superheroes exist, the murder of a colleague sends active vigilante Rorschach into his own sprawling investigation, uncovering something that could completely change the course of history as we know it.",2009,Warner Bros.,130000000.0,55214334.0,107509799,77873014,185382813,2009/3/4,2 hr 42 min,R,162
164,164,140000000.0,Action Adventure Comedy Crime Thriller,944,lapd house on fire revolver,en,Lethal Weapon 4,24.855701,"Silver Pictures, Donner/Shuler-Donner Productions, Warner Bros.",United States of America,1998-07-10,285444603,127.0,"English, 广州话 / 廣州話, 普通话",Released,The faces you love. The action you expect.,lethal weapon 4,6.3,767,Mel Gibson Danny Glover Joe Pesci Rene Russo Jet Li,Richard Donner,166,Color,Richard Donner,141.0,127.0,503.0,91.0,Rene Russo,5000.0,129734803.0,Jet Li,127497,6171,Darlene Love,2.0,287.0,English,USA,R,140000000.0,1998.0,808.0,6.6,2.35,0,"Action,Crime,Thriller",582,"Action,Crime,Thriller",127.0,582,"With personal crises and age weighing in on them, LAPD officers Riggs and Murtaugh must contend with deadly Chinese triads that are trying to free their former leaders out of prison and onto American soil.",1998,Warner Bros.,140000000.0,34048124.0,130444603,155000000,285444603,1998/7/10,2 hr 7 min,R,127
165,165,137000000.0,Drama Action Science Fiction,1927,california san francisco monster general gun,en,Hulk,34.981698,"Universal Pictures, Good Machine, Valhalla Motion Pictures, Marvel Enterprises",United States of America,2003-06-19,245360480,138.0,"English, Español",Released,Unleash the hero within,hulk,5.3,1533,Eric Bana Jennifer Connelly Sam Elliott Josh Lucas Nick Nolte,Ang Lee,167,Color,Ang Lee,267.0,138.0,0.0,258.0,Regi Davis,820.0,132122995.0,Kevin Rankin,212106,1814,Celia Weston,0.0,1445.0,English,USA,PG-13,137000000.0,2003.0,300.0,5.7,1.85,0,"Action,Sci-Fi",684,"Action,Sci-Fi",138.0,684,"Bruce Banner, a genetics researcher with a tragic past, suffers an accident that causes him to transform into a raging green monster when he gets angry.",2003,Universal Pictures,137000000.0,62128420.0,132177234,113107931,245285165,2003/6/19,2 hr 18 min,PG-13,138
169,169,140000000.0,Action Adventure Science Fiction,1771,new york usa world war ii nazis marvel comic,en,Captain America: The First Avenger,74.50624599999998,Marvel Studios,United States of America,2011-07-22,370569774,124.0,"Français, Norsk, English",Released,When patriots become heroes,captain america: the first avenger,6.6,7047,Chris Evans Hugo Weaving Tommy Lee Jones Hayley Atwell Sebastian Stan,Joe Johnston,171,Color,Joe Johnston,510.0,124.0,394.0,2000.0,Dominic Cooper,11000.0,176636816.0,Chris Evans,508818,19761,Hayley Atwell,0.0,679.0,English,USA,PG-13,140000000.0,2011.0,3000.0,6.9,2.35,46000,"Action,Adventure,Sci-Fi",393,"Action,Adventure,Sci-Fi",124.0,393,"Steve Rogers, a rejected military soldier, transforms into Captain America after taking a dose of a ""Super-Soldier serum"". But being Captain America comes at a price as he attempts to take down a warmonger and a terrorist organization.",2011,Paramount Pictures,140000000.0,65058524.0,176654505,193915269,370569774,2011/7/22,2 hr 4 min,PG-13,124
170,170,135000000.0,Adventure Action Thriller,36643,british mission oil heiress bilbao spain,en,The World Is Not Enough,39.604363,"Eon Productions, Metro-Goldwyn-Mayer (MGM)","United Kingdom, United States of America",1999-11-08,361832400,128.0,"English, Pусский",Released,As the countdown begins for the new millennium there is still one number you can always count on.,the world is not enough,6.0,862,Pierce Brosnan Sophie Marceau Robert Carlyle Denise Richards Robbie Coltrane,Michael Apted,172,Color,Michael Apted,197.0,128.0,150.0,244.0,Maria Grazia Cucinotta,766.0,126930660.0,Colin Salmon,157519,2037,Desmond Llewelyn,2.0,683.0,English,UK,PG-13,135000000.0,1999.0,536.0,6.4,2.35,2000,"Action,Adventure,Thriller",412,"Action,Adventure,Thriller",128.0,412,"James Bond uncovers a nuclear plot while protecting an oil heiress from her former kidnapper, an international terrorist who can't feel pain.",1999,Metro-Goldwyn-Mayer (MGM),135000000.0,35519007.0,126943684,234888716,361832400,1999/11/19,2 hr 8 min,PG-13,128
171,171,150000000.0,Adventure,8619,naturalist frigate self surgery sea battle weevil,en,Master and Commander: The Far Side of the World,36.973031,"Universal Pictures, Twentieth Century Fox Film Corporation, Samuel Goldwyn Films, Miramax",United States of America,2003-11-14,212011111,138.0,"Français, Português, English",Released,The courage to do the impossible lies in the hearts of men.,master and commander: the far side of the world,6.9,790,Russell Crowe Paul Bettany James D'Arcy Billy Boyd Joseph Morgan,Peter Weir,173,Color,Peter Weir,244.0,138.0,608.0,168.0,Lee Ingleby,613.0,93926386.0,James D'Arcy,168207,1205,David Threlfall,1.0,684.0,English,USA,PG-13,150000000.0,2003.0,172.0,7.4,2.35,0,"Action,Adventure,Drama,History,War",833,"Action,Adventure,Drama,War",138.0,833,"During the Napoleonic Wars, a brash British captain pushes his ship and crew to their limits in pursuit of a formidable French war vessel around South America.",2003,Twentieth Century Fox,150000000.0,25105990.0,93927920,117694615,211622535,2003/11/14,2 hr 18 min,PG-13,138
172,172,120000000.0,Adventure Fantasy Drama Romance,50620,vampire romance villainess super strength imprinting,en,The Twilight Saga: Breaking Dawn - Part 2,99.687084,"Summit Entertainment, Sunswept Entertainment, Temple Hill Entertainment",United States of America,2012-11-13,829000000,115.0,English,Released,The epic finale that will live forever,the twilight saga: breaking dawn - part 2,6.1,2553,Kristen Stewart Robert Pattinson Taylor Lautner Peter Facinelli Elizabeth Reaser,Bill Condon,174,Color,Bill Condon,322.0,115.0,386.0,12000.0,Kristen Stewart,21000.0,292298923.0,Robert Pattinson,185394,59177,Taylor Lautner,3.0,329.0,English,USA,PG-13,120000000.0,2012.0,17000.0,5.5,2.35,65000,"Adventure,Drama,Fantasy,Romance",89,"Adventure,Drama,Fantasy,Romance",115.0,89,"After the birth of Renesmee/Nessie, the Cullens gather other vampire clans in order to protect the child from a false allegation that puts the family in front of the Volturi.",2012,Lionsgate,120000000.0,141067634.0,292324737,556269211,848593948,2012/11/14,1 hr 55 min,PG-13,115
174,174,150000000.0,Science Fiction Action Adventure,1724,new york rio de janeiro marvel comic superhero based on comic book,en,The Incredible Hulk,62.898336,"Universal Pictures, Marvel Studios, Valhalla Motion Pictures, MVL Incredible Productions",United States of America,2008-06-12,163712074,114.0,"Português, Español, English",Released,You'll like him when he's angry.,the incredible hulk,6.1,3021,Edward Norton Liv Tyler Tim Roth William Hurt Tim Blake Nelson,Louis Leterrier,176,Color,Louis Leterrier,354.0,135.0,255.0,882.0,Peter Mensah,3000.0,134518390.0,Ty Burrell,326286,5811,William Hurt,0.0,643.0,English,USA,PG-13,150000000.0,2008.0,1000.0,6.8,2.35,0,"Action,Adventure,Sci-Fi",621,"Action,Adventure,Sci-Fi",112.0,621,"Bruce Banner, a scientist on the run from the U.S. Government, must find a cure for the monster he turns into whenever he loses his temper.",2008,Universal Pictures,150000000.0,55414050.0,134806913,129964083,264770996,2008/6/11,1 hr 52 min,PG-13,112
175,175,140000000.0,Adventure Family Fantasy,267935,london england england based on novel queen little girl,en,The BFG,44.19092,"Walt Disney Pictures, Amblin Entertainment, Reliance Entertainment, Kennedy/Marshall Company, The, Walden Media","India, United States of America",2016-06-01,183345589,120.0,English,Released,The world is more giant than you can imagine.,the bfg,6.0,1000,Ruby Barnhill Mark Rylance Rebecca Hall Jemaine Clement Bill Hader,Steven Spielberg,178,Color,Steven Spielberg,252.0,117.0,14000.0,358.0,Penelope Wilton,535.0,52792307.0,Mark Rylance,12572,1950,Rafe Spall,0.0,106.0,English,UK,PG,140000000.0,2016.0,400.0,6.8,2.35,27000,"Adventure,Family,Fantasy",917,"Adventure,Family,Fantasy",117.0,917,"An orphan little girl befriends a benevolent giant who takes her to Giant Country, where they attempt to stop the man-eating giants that are invading the human world.",2016,Walt Disney Studios Motion Pictures,140000000.0,18775350.0,55483770,139759641,195243411,2016/6/30,1 hr 57 min,PG,117
176,176,135000000.0,Western Drama Adventure Thriller,281957,father son relationship rape based on novel mountains winter,en,The Revenant,100.635882,"Regency Enterprises, Appian Way, CatchPlay, Anonymous Content, New Regency Pictures, Hong Kong Alpha Motion Pictures Co., RatPac Entertainment, M Productions, Monarchy Enterprises S.a.r.l.","Canada, Hong Kong, Taiwan, United States of America",2015-12-25,532950503,156.0,"English, Français",Released,"(n. One who has returned, as if from the dead.)",the revenant,7.3,6396,Leonardo DiCaprio Tom Hardy Will Poulter Domhnall Gleeson Paul Anderson,Alejandro Gonz\u00e1lez I\u00f1\u00e1rritu,179,Color,Alejandro G. Iñárritu,556.0,156.0,0.0,733.0,Tom Hardy,29000.0,183635922.0,Leonardo DiCaprio,406020,57108,Lukas Haas,0.0,1188.0,English,USA,R,135000000.0,2015.0,27000.0,8.1,2.35,190000,"Adventure,Drama,Thriller,Western",218,"Action,Adventure,Drama,Western",156.0,218,A frontiersman on a fur trading expedition in the 1820s fights for survival after being mauled by a bear and left for dead by members of his own hunting team.,2015,Twentieth Century Fox,135000000.0,474560.0,183637894,349312609,532950503,2015/12/25,2 hr 36 min,R,156
177,177,135000000.0,Animation Family,77950,underdog car race dream speed power,en,Turbo,44.765377,DreamWorks Animation,United States of America,2013-07-11,282570682,96.0,English,Released,SLO NO MO,turbo,6.1,1074,Ryan Reynolds Paul Giamatti Michael Pe\u00f1a Samuel L. Jackson Luis Guzm\u00e1n,David Soren,180,Color,David Soren,166.0,96.0,13.0,463.0,Snoop Dogg,16000.0,83024900.0,Ryan Reynolds,62424,17416,Ben Schwartz,0.0,90.0,English,USA,PG,135000000.0,2013.0,881.0,6.5,2.35,13000,"Adventure,Animation,Comedy,Family,Sport",584,"Adventure,Animation,Comedy,Family,Sport",96.0,584,A freak accident might just help an everyday garden snail achieve his biggest dream: winning the Indy 500.,2013,Twentieth Century Fox,135000000.0,21312625.0,83028128,199542554,282570682,2013/7/10,1 hr 36 min,PG,96
178,178,135000000.0,Animation Comedy Family Western Adventure,44896,sheriff nevada pet rango chameleon,en,Rango,29.91353,"Paramount Pictures, Nickelodeon Movies, GK Films, Blind Wink, Paramount Animation",United States of America,2011-03-02,245724603,107.0,English,Released,Heroes come in all different colors.,rango,6.6,2051,Johnny Depp Isla Fisher Ned Beatty Bill Nighy Alfred Molina,Gore Verbinski,181,Color,Gore Verbinski,362.0,107.0,563.0,939.0,Ray Winstone,40000.0,123207194.0,Johnny Depp,183208,43291,Stephen Root,0.0,337.0,English,USA,PG,135000000.0,2011.0,1000.0,7.2,2.35,26000,"Adventure,Animation,Comedy,Family,Western",679,"Action,Adventure,Animation,Comedy,Family,Western",107.0,679,"Rango is an ordinary chameleon who accidentally winds up in the town of Dirt, a lawless outpost in the Wild West in desperate need of a new sheriff.",2011,Paramount Pictures,135000000.0,38079323.0,123477607,122246996,245724603,2011/3/2,1 hr 47 min,PG,107
179,179,132000000.0,Family Animation Adventure Comedy,270946,penguin madagascar 3d,en,Penguins of Madagascar,84.366984,DreamWorks Animation,United States of America,2014-11-22,373552094,92.0,English,Released,The Movie Event That Will Blow Their Cover,penguins of madagascar,6.5,1346,Tom McGrath Chris Miller Christopher Knights Conrad Vernon John Malkovich,Eric Darnell,182,Color,Eric Darnell,153.0,92.0,35.0,179.0,Annet Mahendru,19000.0,83348920.0,Benedict Cumberbatch,60230,19963,Andy Richter,0.0,118.0,English,USA,PG,132000000.0,2014.0,411.0,6.7,1.85,11000,"Adventure,Animation,Comedy,Family",387,"Action,Adventure,Animation,Comedy,Crime,Family,Sci-Fi",92.0,387,"Skipper, Kowalski, Rico and Private join forces with undercover organization The North Wind to stop the villainous Dr. Octavius Brine from destroying the world as we know it.",2014,Twentieth Century Fox,132000000.0,25447444.0,83850911,289664710,373515621,2014/11/14,1 hr 32 min,PG,92
180,180,70000000.0,Action Drama Mystery Thriller,2503,paris corruption madrid assassin based on novel,en,The Bourne Ultimatum,45.381501,"Universal Pictures, The Kennedy/Marshall Company, Ludlum Entertainment, Motion Picture BETA Produktionsgesellschaft, Bourne Again","Germany, United States of America",2007-08-03,442824138,115.0,"English, Français, العربية, Pусский, Español",Released,Remember everything. Forgive nothing.,the bourne ultimatum,7.3,2888,Matt Damon Julia Stiles David Strathairn Scott Glenn Paddy Considine,Paul Greengrass,183,Color,Paul Greengrass,329.0,115.0,521.0,883.0,Edgar Ramírez,13000.0,227137090.0,Matt Damon,491077,17369,Albert Finney,0.0,820.0,English,USA,PG-13,110000000.0,2007.0,897.0,8.1,2.35,0,"Action,Mystery,Thriller",293,"Action,Mystery,Thriller",115.0,293,Jason Bourne dodges a ruthless C.I.A. official and his Agents from a new assassination program while searching for the origins of his life as a trained killer.,2007,Universal Pictures,110000000.0,69283690.0,227471070,216628965,444100035,2007/8/3,1 hr 55 min,PG-13,115
181,181,130000000.0,Adventure Animation Family Comedy,9502,china martial arts kung fu mentor snake,en,Kung Fu Panda,84.68964799999998,DreamWorks Animation,United States of America,2008-06-04,631744560,90.0,English,Released,Prepare for awesomeness.,kung fu panda,6.9,3145,Jack Black Dustin Hoffman Angelina Jolie Jackie Chan Lucy Liu,Mark Osborne,184,Color,Mark Osborne,266.0,92.0,54.0,562.0,Wayne Knight,11000.0,215395021.0,Angelina Jolie Pitt,307029,12754,Dan Fogler,0.0,360.0,English,USA,PG,130000000.0,2008.0,967.0,7.6,2.35,6000,"Action,Adventure,Animation,Comedy,Family",165,"Action,Adventure,Animation,Comedy,Family,Fantasy",92.0,165,"To everyone's surprise, including his own, Po, an overweight, clumsy panda, is chosen as protector of the Valley of Peace. His suitability will soon be tested as the valley's arch-enemy is on his way.",2008,DreamWorks,130000000.0,60239130.0,215771591,416311606,632083197,2008/6/5,1 hr 32 min,PG,92
182,182,130000000.0,Science Fiction Action Adventure,102899,marvel comic superhero based on comic book aftercreditsstinger duringcreditsstinger,en,Ant-Man,120.09361,Marvel Studios,United States of America,2015-07-14,519311965,117.0,English,Released,Heroes don't get any bigger.,ant-man,7.0,5880,Paul Rudd Michael Douglas Evangeline Lilly Corey Stoll Bobby Cannavale,Peyton Reed,185,Color,Peyton Reed,517.0,117.0,235.0,680.0,Hayley Atwell,2000.0,180191634.0,Judy Greer,313866,5730,T.I.,6.0,549.0,English,USA,PG-13,130000000.0,2015.0,2000.0,7.4,1.85,61000,"Action,Adventure,Comedy,Sci-Fi",232,"Action,Comedy,Sci-Fi",117.0,232,"Armed with a super-suit with the astonishing ability to shrink in scale but increase in strength, cat burglar Scott Lang must embrace his inner hero and help his mentor, Dr. Hank Pym, pull off a plan that will save the world.",2015,Walt Disney Studios Motion Pictures,130000000.0,57225526.0,180202163,339109802,519311965,2015/7/10,1 hr 57 min,PG-13,117
183,183,130000000.0,Adventure Action Science Fiction,101299,competition based on novel mentor secret factory,en,The Hunger Games: Catching Fire,76.310119,"Lionsgate, Color Force",United States of America,2013-11-15,847423452,146.0,English,Released,Every revolution begins with a spark.,the hunger games: catching fire,7.4,6495,Jennifer Lawrence Josh Hutcherson Liam Hemsworth Woody Harrelson Elizabeth Banks,Francis Lawrence,186,Color,Francis Lawrence,502.0,146.0,508.0,523.0,Josh Hutcherson,34000.0,424645577.0,Jennifer Lawrence,498397,49355,Sandra Ellis Lafferty,1.0,706.0,English,USA,PG-13,130000000.0,2013.0,14000.0,7.6,2.35,82000,"Adventure,Sci-Fi,Thriller",83,"Action,Adventure,Sci-Fi,Thriller",146.0,83,Katniss Everdeen and Peeta Mellark become targets of the Capitol after their victory in the 74th Hunger Games sparks a rebellion in the Districts of Panem.,2013,Lionsgate,130000000.0,158074286.0,424668047,440343699,865011746,2013/11/15,2 hr 26 min,PG-13,146
184,184,135000000.0,Fantasy Comedy Animation Science Fiction Family,228161,friendship spaceship space alien alien invasion,en,Home,63.473086,"Twentieth Century Fox Film Corporation, DreamWorks Animation",United States of America,2015-03-18,368871007,94.0,English,Released,Worlds Collide,home,6.8,1519,Jim Parsons Rihanna Steve Martin Jennifer Lopez Matt Jones,Tim Johnson,188,Color,Tim Johnson,165.0,94.0,12.0,183.0,Matt Jones,17000.0,177343675.0,Jim Parsons,70121,17883,April Winchell,0.0,214.0,English,USA,PG,135000000.0,2015.0,523.0,6.7,1.85,26000,"Adventure,Animation,Comedy,Family,Fantasy,Sci-Fi",363,"Adventure,Animation,Comedy,Family,Fantasy,Sci-Fi",94.0,363,"An alien on the run from his own people makes friends with a girl. He tries to help her on her quest, but can be an interference.",2015,Twentieth Century Fox,135000000.0,52107731.0,177397510,208644097,386041607,2015/3/19,1 hr 34 min,PG,94
184,184,135000000.0,Fantasy Comedy Animation Science Fiction Family,228161,friendship spaceship space alien alien invasion,en,Home,63.473086,"Twentieth Century Fox Film Corporation, DreamWorks Animation",United States of America,2015-03-18,368871007,94.0,English,Released,Worlds Collide,home,6.8,1519,Jim Parsons Rihanna Steve Martin Jennifer Lopez Matt Jones,Tim Johnson,3010,Color,Tim Johnson,165.0,94.0,12.0,183.0,Matt Jones,17000.0,177343675.0,Jim Parsons,70133,17883,April Winchell,0.0,214.0,English,USA,PG,135000000.0,2015.0,523.0,6.7,1.85,26000,"Adventure,Animation,Comedy,Family,Fantasy,Sci-Fi",363,"Adventure,Animation,Comedy,Family,Fantasy,Sci-Fi",94.0,363,"An alien on the run from his own people makes friends with a girl. He tries to help her on her quest, but can be an interference.",2015,Twentieth Century Fox,135000000.0,52107731.0,177397510,208644097,386041607,2015/3/19,1 hr 34 min,PG,94
184,184,135000000.0,Fantasy Comedy Animation Science Fiction Family,228161,friendship spaceship space alien alien invasion,en,Home,63.473086,"Twentieth Century Fox Film Corporation, DreamWorks Animation",United States of America,2015-03-18,368871007,94.0,English,Released,Worlds Collide,home,6.8,1519,Jim Parsons Rihanna Steve Martin Jennifer Lopez Matt Jones,Tim Johnson,4752,Color,Tim Johnson,165.0,94.0,12.0,183.0,Matt Jones,17000.0,177343675.0,Jim Parsons,70136,17883,April Winchell,0.0,214.0,English,USA,PG,135000000.0,2015.0,523.0,6.7,1.85,26000,"Adventure,Animation,Comedy,Family,Fantasy,Sci-Fi",363,"Adventure,Animation,Comedy,Family,Fantasy,Sci-Fi",94.0,363,"An alien on the run from his own people makes friends with a girl. He tries to help her on her quest, but can be an interference.",2015,Twentieth Century Fox,135000000.0,52107731.0,177397510,208644097,386041607,2015/3/19,1 hr 34 min,PG,94
185,185,132000000.0,Adventure Thriller Science Fiction,74,post traumatic stress  disorder new jersey airplane dystopia daughter,en,War of the Worlds,48.572726,"Paramount Pictures, DreamWorks SKG, Cruise/Wagner Productions, Amblin Entertainment",United States of America,2005-06-28,591739379,116.0,English,Released,They're already here.,war of the worlds,6.2,2322,Tom Cruise Dakota Fanning Miranda Otto Justin Chatwin Tim Robbins,Steven Spielberg,189,Color,Steven Spielberg,401.0,116.0,14000.0,807.0,Lisa Ann Walter,10000.0,234277056.0,Tom Cruise,334345,12758,Rick Gonzalez,0.0,2741.0,English,USA,PG-13,132000000.0,2005.0,1000.0,6.5,1.85,0,"Adventure,Sci-Fi,Thriller",183,"Action,Adventure,Sci-Fi",116.0,183,An alien invasion threatens the future of humanity. The catastrophic nightmare is depicted through the eyes of one American family fighting for survival.,2005,Paramount Pictures,132000000.0,64878725.0,234280354,369592765,603873119,2005/6/29,1 hr 56 min,PG-13,116
186,186,130000000.0,Adventure Action Comedy Thriller Crime,8961,miami ku klux klan cuba undercover mexican standoff,en,Bad Boys II,38.068736,"Columbia Pictures Corporation, Don Simpson/Jerry Bruckheimer Films",United States of America,2003-07-18,273339556,147.0,"English, Español",Released,"If you can't stand the heat, get out of Miami.",bad boys ii,6.3,1564,Martin Lawrence Will Smith Jordi Moll\u00e0 Gabrielle Union Peter Stormare,Michael Bay,190,Color,Michael Bay,94.0,147.0,0.0,877.0,Henry Rollins,10000.0,138396624.0,Will Smith,178126,12954,Jordi Mollà,1.0,511.0,English,USA,R,130000000.0,2003.0,898.0,6.6,2.35,0,"Action,Comedy,Crime,Thriller",601,"Action,Comedy,Crime,Thriller",147.0,601,Two loose-cannon narcotics cops investigate the flow of Ecstasy into Florida from a Cuban drug cartel.,2003,Sony Pictures Entertainment (SPE),130000000.0,46522560.0,138608444,134731112,273339556,2003/7/18,2 hr 27 min,R,147
187,187,130000000.0,Action Adventure Animation Family Fantasy,417859,adventure fairy-tale figure,en,Puss in Boots,20.678787,DreamWorks,United States of America,2011-10-28,554987477,90.0,"Español, English",Released,Live for danger. Fight for justice. Pray for mercy.,puss in boots,6.4,451,Antonio Banderas Salma Hayek Zach Galifianakis Billy Bob Thornton Amy Sedaris,Chris Miller,191,Color,Chris Miller,246.0,90.0,50.0,397.0,Constance Marie,4000.0,149234747.0,Salma Hayek,114287,5046,Amy Sedaris,0.0,137.0,English,USA,PG,130000000.0,2011.0,442.0,6.7,2.35,16000,"Action,Adventure,Animation,Comedy,Family,Fantasy",201,"Adventure,Animation,Comedy,Family,Fantasy,Mystery,Romance",90.0,201,"An outlaw cat, his childhood egg-friend, and a seductive thief kitty set out in search for the eggs of the fabled Golden Goose to clear his name, restore his lost honor, and regain the trust of his mother and town.",2011,DreamWorks,130000000.0,34077439.0,149260504,405726973,554987477,2011/10/27,1 hr 30 min,PG,90
188,188,110000000.0,Action Mystery Thriller,27576,assassination spy cia kidnapping cold war,en,Salt,48.829437,"Columbia Pictures, Di Bonaventura Pictures, Relativity Media, Wintergreen Productions",United States of America,2010-07-21,293329073,100.0,"English, Pусский, 한국어/조선말",Released,Who is Salt?,salt,6.2,2093,Angelina Jolie Liev Schreiber Chiwetel Ejiofor Daniel Olbrychski August Diehl,Phillip Noyce,192,Color,Phillip Noyce,330.0,101.0,176.0,282.0,Andre Braugher,11000.0,118311368.0,Angelina Jolie Pitt,245621,12406,August Diehl,1.0,514.0,English,USA,PG-13,110000000.0,2010.0,702.0,6.4,2.35,23000,"Action,Crime,Mystery,Thriller",563,"Action,Thriller",100.0,563,A CIA agent goes on the run after a defector accuses her of being a Russian spy.,2010,Sony Pictures Entertainment (SPE),110000000.0,36011243.0,118311368,175191986,293503354,2010/7/21,1 hr 40 min,PG-13,100
