842,842,55000000.0,Family Comedy,116149,england train station based on novel bear anthropomorphism,en,Paddington,39.882276,"The Weinstein Company, StudioCanal, TF1 Films Production, Canal+, Heyday Films, Ciné+, Anton Capital Entertainment (ACE), TF1, Amazon Prime Instant Video",United Kingdom,2014-11-27,259207227,95.0,English,Released,The Adventure Begins,paddington,7.0,883,Nicole Kidman Peter Capaldi Ben Whishaw Michael Gambon Imelda Staunton,Paul King,870,Color,Paul King,224.0,95.0,17.0,594.0,Matt Lucas,838.0,76137505.0,Julie Walters,49207,3697,Sally Hawkins,0.0,174.0,English,UK,PG,55000000.0,2014.0,722.0,7.2,2.35,30000,"Animation,Comedy,Family,Fantasy",585,"Adventure,Comedy,Family,Fantasy",95.0,585,"A young Peruvian bear travels to London in search of a home. Finding himself lost and alone at Paddington Station, he meets the kindly Brown family, who offer him a temporary haven.",2014,Dimension Films,55000000.0,18966676.0,76271832,206167002,282438834,2014/11/27,1 hr 35 min,PG,95
875,875,52500000.0,Drama Music Romance,824,duke musical writer's block music terminal illness,en,Moulin Rouge!,57.374341,"Bazmark Films, Twentieth Century Fox Film Corporation","Australia, United States of America",2001-03-09,179213434,127.0,"Français, Español, English",Released,No Laws. No Limits. One Rule. Never Fall In Love.,moulin rouge!,7.4,1300,Nicole Kidman Ewan McGregor John Leguizamo Jim Broadbent Richard Roxburgh,Baz Luhrmann,903, Black and White,Baz Luhrmann,209.0,127.0,1000.0,653.0,Kylie Minogue,1000.0,57386369.0,Jim Broadbent,224013,2601,Richard Roxburgh,1.0,2319.0,English,USA,PG-13,52500000.0,2001.0,691.0,7.6,2.35,10000,"Drama,Musical,Romance",965,"Drama,Musical,Romance",127.0,965,A poor Bohemian poet in 1890s Paris falls for a beautiful courtesan and nightclub star coveted by a jealous duke.,2001,Twentieth Century Fox,50000000.0,167540.0,57386607,127541935,184928542,2001/5/18,2 hr 7 min,PG-13,127
883,883,52000000.0,Drama Crime,640,con man biography fbi agent overhead camera shot attempted jailbreak,en,Catch Me If You Can,73.94404899999998,"Kemp Company, Splendid Pictures, Parkes/MacDonald Productions",United States of America,2002-12-25,352114312,141.0,"English, Français",Released,The true story of a real fake.,catch me if you can,7.7,3795,Leonardo DiCaprio Tom Hanks Christopher Walken Martin Sheen Nathalie Baye,Steven Spielberg,911,Color,Steven Spielberg,194.0,141.0,14000.0,3000.0,Tom Hanks,29000.0,164435221.0,Leonardo DiCaprio,525801,48153,Jennifer Garner,0.0,667.0,English,USA,PG-13,52000000.0,2002.0,15000.0,8.0,1.85,15000,"Biography,Crime,Drama",434,"Biography,Crime,Drama",141.0,434,"Barely 21 yet, Frank is a skilled forger who has passed as a doctor, lawyer and pilot. FBI agent Carl becomes obsessed with tracking down the con man, who only revels in the pursuit.",2002,DreamWorks Distribution,52000000.0,30053627.0,164615351,187498961,352114312,2002/12/25,2 hr 21 min,PG-13,141
885,885,52000000.0,Romance Comedy,9767,bowling chicago american football flat baseball,en,The Break-Up,26.251216999999997,"Universal Pictures, Mosaic Media Group, Wild West Picture Show Productions",United States of America,2006-06-01,204999686,106.0,English,Released,. . . pick a side.,the break-up,5.6,832,Vince Vaughn Jennifer Aniston Joey Lauren Adams Cole Hauser Jon Favreau,Peyton Reed,913,Color,Peyton Reed,183.0,106.0,235.0,931.0,John Michael Higgins,4000.0,118683135.0,Jon Favreau,102167,8315,Ann-Margret,1.0,483.0,English,USA,PG-13,52000000.0,2006.0,957.0,5.8,1.85,0,"Comedy,Drama,Romance",859,"Comedy,Drama,Romance",106.0,859,A couple's break-up proceeds to get uglier and nastier by the moment as each tries to keep their luxurious condo from the other.,2006,Universal Pictures,52000000.0,39172785.0,118703275,86964935,205668210,2006/6/2,1 hr 46 min,PG-13,106
886,886,52000000.0,Comedy Romance,11631,single parent greece musical daughter single,en,Mamma Mia!,30.780599,"Universal Pictures, Internationale Filmproduktion Richter, Playtone, Relativity Media, Littlestar","Germany, United Kingdom, United States of America",2008-07-03,609841637,108.0,"English, ελληνικά",Released,Take a trip down the aisle you'll never forget,mamma mia!,6.4,1386,Meryl Streep Pierce Brosnan Amanda Seyfried Colin Firth Stellan Skarsg\u00e5rd,Phyllida Lloyd,914,Color,Phyllida Lloyd,238.0,108.0,58.0,838.0,Meryl Streep,14000.0,143704210.0,Colin Firth,145974,26002,Julie Walters,1.0,611.0,English,USA,PG-13,52000000.0,2008.0,11000.0,6.3,2.35,10000,"Comedy,Family,Musical,Romance",144,"Comedy,Musical,Romance",108.0,144,The story of a bride-to-be trying to find her real father told using hit songs by the popular 1970s group ABBA.,2008,Universal Pictures,52000000.0,27751240.0,144169664,550308728,694478392,2008/6/27,1 hr 48 min,PG-13,108
887,887,52000000.0,Comedy Romance,32856,flower married couple florist kiss single,en,Valentine's Day,25.41929,"New Line Cinema, Karz Entertainment, Rice Films",United States of America,2010-02-10,216485654,125.0,English,Released,A Love Story. More or Less.,valentine's day,5.7,1013,Jessica Alba Jessica Biel Bradley Cooper Eric Dane Patrick Dempsey,Garry Marshall,915,Color,Garry Marshall,186.0,125.0,0.0,11000.0,Taylor Lautner,14000.0,110476776.0,Bradley Cooper,95437,45696,Anne Hathaway,12.0,211.0,English,USA,PG-13,52000000.0,2010.0,12000.0,5.7,1.85,9000,"Comedy,Romance",797,"Comedy,Romance",125.0,797,Intertwining couples and singles in Los Angeles break-up and make-up based on the pressures and expectations of Valentine's Day.,2010,Warner Bros.,52000000.0,56260707.0,110528528,106000000,216528528,2010/2/10,2 hr 5 min,PG-13,125
898,898,50000000.0,Adventure Fantasy Drama Romance,18239,moon cinema vampire werewolf fang vamp,en,The Twilight Saga: New Moon,94.815867,"Summit Entertainment, Maverick Films, Imprint Entertainment, Sunswept Entertainment, Temple Hill Entertainment",United States of America,2009-03-15,709827462,130.0,"English, Italiano",Released,The Next Chapter Begins.,the twilight saga: new moon,5.6,2436,Kristen Stewart Robert Pattinson Taylor Lautner Billy Burke Ashley Greene,Chris Weitz,926,Color,Chris Weitz,299.0,130.0,129.0,12000.0,Kristen Stewart,21000.0,296623634.0,Robert Pattinson,220758,64040,Taylor Lautner,2.0,919.0,English,USA,PG-13,50000000.0,2009.0,17000.0,4.6,2.35,13000,"Adventure,Drama,Fantasy,Romance",134,"Adventure,Drama,Fantasy,Romance",130.0,134,"Edward leaves Bella after an attack that nearly claimed her life, and, in her depression, she falls into yet another difficult relationship - this time with her close friend, Jacob Black.",2009,Summit Entertainment,50000000.0,142839137.0,297816253,413209228,711025481,2009/11/18,2 hr 10 min,PG-13,130
899,899,60000000.0,Adventure Animation Comedy Family Fantasy,808,magic liberation lordship castle robin hood,en,Shrek,67.298732,"DreamWorks SKG, Pacific Data Images (PDI), DreamWorks Animation",United States of America,2001-05-16,484409218,90.0,English,Released,The greatest fairy tale never told.,shrek,7.3,4056,Mike Myers Eddie Murphy Cameron Diaz John Lithgow Vincent Cassel,Andrew Adamson,927,Color,Andrew Adamson,212.0,90.0,80.0,21.0,Chris Miller,145.0,267652016.0,Kathleen Freeman,467113,275,Bobby Block,1.0,945.0,English,USA,PG,60000000.0,2001.0,50.0,7.9,1.85,0,"Adventure,Animation,Comedy,Family,Fantasy",246,"Adventure,Animation,Comedy,Family,Fantasy,Romance",90.0,246,"A mean lord exiles fairytale creatures to the swamp of a grumpy ogre, who must go on a quest and rescue a princess for the lord in order to get his land back.",2001,DreamWorks Distribution,60000000.0,42347760.0,268163011,220278357,488441368,2001/5/16,1 hr 30 min,PG,90
901,901,48000000.0,Adventure,8367,england crusade mercifulness robin hood folk hero,en,Robin Hood: Prince of Thieves,28.803728999999997,"Warner Bros., Morgan Creek Productions",United States of America,1991-06-14,390493908,143.0,English,Released,"For the good of all men, and the love of one woman, he fought to uphold justice by breaking the law.",robin hood: prince of thieves,6.6,909,Kevin Costner Morgan Freeman Christian Slater Mary Elizabeth Mastrantonio Alan Rickman,Kevin Reynolds,929,Color,Kevin Reynolds,67.0,155.0,58.0,720.0,Morgan Freeman,25000.0,165500000.0,Alan Rickman,145257,38518,Michael Wincott,0.0,322.0,English,USA,PG-13,48000000.0,1991.0,11000.0,6.9,1.85,0,"Action,Adventure,Drama,Romance",357,"Action,Adventure,Drama,Romance",143.0,357,Robin Hood decides to fight back as an outlaw when faced with the tyranny of the Sheriff of Nottingham.,1991,Warner Bros.,48000000.0,25625602.0,165493908,225000000,390493908,1991/6/14,2 hr 23 min,,143
902,902,50000000.0,Comedy Drama Romance,9390,stadium career sport sports agent,en,Jerry Maguire,27.039636,"Gracie Films, TriStar Pictures",United States of America,1996-12-06,273552592,139.0,"English, Polski",Released,Everybody loved him... Everybody disappeared.,jerry maguire,6.7,913,Tom Cruise Cuba Gooding Jr. Ren\u00e9e Zellweger Kelly Preston Alison Armitage,Cameron Crowe,930,Color,Cameron Crowe,109.0,139.0,488.0,597.0,Kelly Preston,10000.0,153620822.0,Tom Cruise,189923,12182,Bonnie Hunt,0.0,318.0,English,USA,R,50000000.0,1996.0,743.0,7.3,1.85,0,"Comedy,Drama,Romance,Sport",600,"Comedy,Drama,Romance,Sport",139.0,600,"When a sports agent has a moral epiphany and is fired for expressing it, he decides to put his new philosophy to the test as an independent agent with the only athlete who stays with him and his former colleague.",1996,Sony Pictures Entertainment (SPE),50000000.0,17084296.0,153952592,119600000,273552592,1996/12/13,2 hr 19 min,R,139
903,903,50000000.0,Comedy Fantasy,72105,friendship love teddy bear toy comes to life wishes come true,en,Ted,68.87691,"Universal Pictures, Media Rights Capital, Fuzzy Door Productions",United States of America,2012-06-29,549368315,106.0,English,Released,Ted is coming.,ted,6.3,4697,Mark Wahlberg Mila Kunis Seth MacFarlane Joel McHale Giovanni Ribisi,Seth MacFarlane,931,Color,Seth MacFarlane,457.0,112.0,3000.0,1000.0,Seth MacFarlane,15000.0,218628680.0,Mila Kunis,471644,21773,Tom Skerritt,1.0,623.0,English,USA,R,50000000.0,2012.0,3000.0,7.0,1.85,74000,"Comedy,Fantasy",205,Comedy,106.0,205,"John Bennett, a man whose childhood wish of bringing his teddy bear to life came true, now must decide between keeping the relationship with the bear, Ted or his girlfriend, Lori.",2012,Universal Pictures,50000000.0,54415205.0,218815487,330552828,549368315,2012/6/29,1 hr 46 min,R,106
904,904,50000000.0,Comedy Romance,2898,single parent waitress lone wolf friendship neighbor,en,As Good as It Gets,37.885022,"Gracie Films, TriStar Pictures",United States of America,1997-12-19,314178011,139.0,English,Released,A comedy from the heart that goes for the throat.,as good as it gets,7.2,915,Jack Nicholson Helen Hunt Greg Kinnear Cuba Gooding Jr. Skeet Ulrich,James L. Brooks,932,Color,James L. Brooks,156.0,139.0,274.0,285.0,Yeardley Smith,625.0,147637474.0,Lupe Ontiveros,224671,1474,Shirley Knight,0.0,470.0,English,USA,PG-13,50000000.0,1997.0,440.0,7.7,1.85,11000,"Comedy,Drama,Romance",509,"Comedy,Drama,Romance",139.0,509,"A single mother and waitress, a misanthropic author, and a gay artist form an unlikely friendship after the artist is assaulted in a robbery.",1997,Sony Pictures Entertainment (SPE),50000000.0,12606928.0,148478011,165700000,314178011,1997/12/23,2 hr 19 min,PG-13,139
905,905,50000000.0,Comedy Drama,10312,nurse hospital doctor laughter,en,Patch Adams,35.537397,"Universal Pictures, Bungalow 78 Productions, Blue Wolf, Farrell/Minoff",United States of America,1998-12-25,202292902,115.0,English,Released,Laughter is contagious,patch adams,7.0,832,Robin Williams Philip Seymour Hoffman Bob Gunton Peter Coyote Michael Jeter,Tom Shadyac,933,Color,Tom Shadyac,55.0,115.0,293.0,878.0,Philip Seymour Hoffman,49000.0,135014968.0,Robin Williams,80580,74382,Monica Potter,1.0,375.0,English,USA,PG-13,50000000.0,1998.0,22000.0,6.7,2.35,0,"Biography,Comedy,Drama,Romance",881,"Biography,Comedy,Drama,Romance",115.0,881,"The true story of a heroic man, Hunter ""Patch"" Adams, determined to become a medical doctor because he enjoys helping people. He ventured where no doctor had ventured before, using humour and pathos.",1998,Universal Pictures,90000000.0,25262280.0,135026902,67266000,202292902,1998/12/25,1 hr 55 min,PG-13,115
908,908,50000000.0,Thriller Science Fiction Mystery,37686,1970s secret alien train crash pistol,en,Super 8,37.069253,"Paramount Pictures, Amblin Entertainment, Bad Robot, K/O Camera Toys",United States of America,2011-06-08,260095987,112.0,English,Released,It Arrives.,super 8,6.6,2435,Joel Courtney Elle Fanning Riley Griffiths Kyle Chandler Ryan Lee,J.J. Abrams,936,Color,J.J. Abrams,539.0,112.0,14000.0,417.0,AJ Michalka,1000.0,126975169.0,Joel Courtney,287822,3388,Zach Mills,0.0,849.0,English,USA,PG-13,50000000.0,2011.0,560.0,7.1,2.35,37000,"Mystery,Sci-Fi,Thriller",635,"Action,Mystery,Sci-Fi,Thriller",112.0,635,"During the summer of 1979, a group of friends witness a train crash and investigate subsequent unexplained events in their small town.",2011,Paramount Pictures,50000000.0,35451168.0,127004179,133091807,260095986,2011/6/9,1 hr 52 min,PG-13,112
909,909,52000000.0,Drama,462,biography based on true story single mother water pollution environmental law,en,Erin Brockovich,30.347332,Jersey Films,United States of America,2000-03-17,256271286,131.0,"English, Français",Released,She brought a small town to its feet and a huge corporation to its knees.,erin brockovich,7.1,716,Julia Roberts Albert Finney Aaron Eckhart Marg Helgenberger Cherry Jones,Steven Soderbergh,937,Color,Steven Soderbergh,169.0,131.0,0.0,658.0,Albert Finney,8000.0,125548685.0,Julia Roberts,135246,10003,Conchata Ferrell,0.0,498.0,English,USA,R,52000000.0,2000.0,883.0,7.3,1.85,0,"Biography,Drama",646,"Biography,Drama",131.0,646,An unemployed single mother becomes a legal assistant and almost single-handedly brings down a California power company accused of polluting a city's water supply.,2000,Universal Pictures,52000000.0,28138465.0,125595205,130676081,256271286,2000/3/17,2 hr 11 min,R,131
911,911,50000000.0,Crime Comedy Action,187017,high school undercover cop buddy comedy aftercreditsstinger duringcreditsstinger,en,22 Jump Street,52.380982,"Columbia Pictures, Original Film, Media Rights Capital, Metro-Goldwyn-Mayer (MGM), Cannell Studios, LStar Capital, 33andOut Productions, JHF Productions",United States of America,2014-06-05,188441614,112.0,English,Released,They're not 21 anymore,22 jump street,7.0,3319,Jonah Hill Channing Tatum Dave Franco Ice Cube Nick Offerman,Phil Lord,939,Color,Phil Lord,330.0,112.0,97.0,584.0,Craig Roberts,17000.0,191616238.0,Channing Tatum,258186,19428,Amber Stevens West,2.0,322.0,English,USA,R,50000000.0,2014.0,920.0,7.1,2.35,24000,"Action,Comedy,Crime",475,"Action,Comedy,Crime",112.0,475,"After making their way through high school (twice), big changes are in store for officers Schmidt and Jenko when they go deep undercover at a local college.",2014,Sony Pictures Entertainment (SPE),50000000.0,57071445.0,191719337,139614539,331333876,2014/6/5,1 hr 52 min,R,112
913,913,70000000.0,Comedy,10201,bungee-jump scooter,en,Yes Man,43.849351,"Village Roadshow Pictures, The Zanuck Company, Heyday films, Warner Bros.",United States of America,2008-12-09,225990978,104.0,"Eesti, English, 한국어/조선말",Released,One Word Can Change Everything.,yes man,6.4,1813,Jim Carrey Zooey Deschanel Rhys Darby Sasha Alexander Fionnula Flanagan,Peyton Reed,941,Color,Peyton Reed,190.0,104.0,235.0,1000.0,Zooey Deschanel,14000.0,97680195.0,Bradley Cooper,271691,29505,Danny Masterson,1.0,243.0,English,USA,PG-13,70000000.0,2008.0,11000.0,6.8,2.35,0,"Comedy,Romance",767,"Comedy,Romance",104.0,767,"A man challenges himself to say ""yes"" to everything.",2008,Warner Bros.,70000000.0,18262471.0,97690976,125550661,223241637,2008/12/18,1 hr 44 min,PG-13,104
914,914,50000000.0,Action Comedy,302699,spy cia espionage high school reunion reference to facebook,en,Central Intelligence,45.318703,"New Line Cinema, Universal Pictures, Bluegrass Films, Principato-Young Entertainment",United States of America,2016-06-15,216972543,107.0,English,Released,Saving the world takes a little Hart and a big Johnson,central intelligence,6.2,1650,Dwayne Johnson Kevin Hart Amy Ryan Aaron Paul Danielle Nicolet,Rawson Marshall Thurber,942,Color,Rawson Marshall Thurber,177.0,107.0,43.0,569.0,Thomas Kretschmann,12000.0,126088877.0,Dwayne Johnson,33354,14569,Megan Park,2.0,110.0,English,USA,PG-13,50000000.0,2016.0,919.0,6.6,2.35,10000,"Action,Comedy,Crime",793,"Action,Comedy,Crime",107.0,793,"After he reconnects with an awkward pal from high school through Facebook, a mild-mannered accountant is lured into the world of international espionage.",2016,Warner Bros.,50000000.0,35535250.0,127440871,89531672,216972543,2016/6/15,1 hr 47 min,PG-13,107
916,916,50000000.0,Comedy,274167,daddys home,en,Daddy's Home,38.616744,"Paramount Pictures, Gary Sanchez Productions, Red Granite Pictures",United States of America,2015-12-25,242786137,96.0,English,Released,Choose your Daddy,daddy's home,5.8,854,Will Ferrell Mark Wahlberg Linda Cardellini Thomas Haden Church Scarlett Estevez,Sean Anders,944,Color,Sean Anders,145.0,96.0,51.0,322.0,Linda Cardellini,8000.0,150315155.0,Will Ferrell,54010,10886,Mark L. Young,2.0,130.0,English,USA,PG-13,50000000.0,2015.0,2000.0,6.1,1.85,13000,"Comedy,Family",696,"Drama,Music",110.0,696,"Brad Whitaker is a radio host trying to get his stepchildren to love him and call him Dad. But his plans turn upside down when their biological father, Dusty Mayron, returns.",2015,Paramount Pictures,85000000.0,38740203.0,150357137,92429000,242786137,2002/11/8,1 hr 50 min,R,110
917,917,50000000.0,Fantasy Comedy Music,224141,witch cinderella prince fairy tale musical,en,Into the Woods,65.90160999999999,"Walt Disney Pictures, Marc Platt Productions, Lucamar Productions",United States of America,2014-12-25,212902372,125.0,English,Released,Be careful what you wish for...,into the woods,5.6,1652,Meryl Streep Emily Blunt James Corden Anna Kendrick Chris Pine,Rob Marshall,945,Color,Rob Marshall,321.0,125.0,252.0,10000.0,Meryl Streep,40000.0,127997349.0,Johnny Depp,101178,62837,Anna Kendrick,1.0,779.0,English,USA,PG,50000000.0,2014.0,11000.0,6.0,2.39,90000,"Adventure,Comedy,Drama,Fantasy,Musical",821,"Adventure,Comedy,Drama,Fantasy,Musical",125.0,821,A witch tasks a childless baker and his wife with procuring magical items from classic fairy tales to reverse the curse put on their family tree.,2014,Walt Disney Studios Motion Pictures,50000000.0,31051923.0,128002372,84900000,212902372,2014/12/24,2 hr 5 min,PG,125
918,918,45000000.0,Crime Drama Thriller,388,bank manager kidnapping nazi background document ultimatum,en,Inside Man,45.220386,"Imagine Entertainment, Universal Pictures, 40 Acres & A Mule Filmworks",United States of America,2006-03-23,184376254,129.0,"English, shqip",Released,It looked like the perfect bank robbery. But you can't judge a crime by its cover.,inside man,7.3,1630,Denzel Washington Clive Owen Jodie Foster Christopher Plummer Willem Dafoe,Spike Lee,946,Color,Spike Lee,230.0,129.0,0.0,277.0,James Ransone,18000.0,88504640.0,Denzel Washington,273108,19148,Peter Gerety,2.0,646.0,English,USA,R,45000000.0,2006.0,412.0,7.6,2.35,0,"Crime,Drama,Mystery,Thriller",959,"Crime,Drama,Mystery,Thriller",129.0,959,"A police detective, a bank robber, and a high-power broker enter high-stakes negotiations after the criminal's brilliant heist spirals into a hostage situation.",2006,Universal Pictures,45000000.0,28954945.0,88513495,97490096,186003591,2006/3/23,2 hr 9 min,R,129
922,922,50000000.0,Action Adventure Drama Mystery Science Fiction,13811,cataclysm code suspense end of the world time capsule,en,Knowing,32.693093,"Summit Entertainment, Mystery Clock Cinema, Escape Artists, Goldcrest Pictures, Kaplan/Perrone Entertainment, Wintergreen Productions","United Kingdom, United States of America, Australia",2009-03-19,155446362,121.0,English,Released,Knowing is everything...,knowing,5.9,1486,Nicolas Cage Rose Byrne Chandler Canterbury Ben Mendelsohn Nadia Townsend,Alex Proyas,950,Color,Alex Proyas,279.0,121.0,295.0,329.0,Ben Mendelsohn,12000.0,79948113.0,Nicolas Cage,186879,13421,Chandler Canterbury,0.0,791.0,English,USA,PG-13,50000000.0,2009.0,748.0,6.2,2.35,0,"Drama,Mystery,Sci-Fi,Thriller",971,"Action,Mystery,Sci-Fi,Thriller",121.0,971,M.I.T. professor John Koestler links a mysterious list of numbers from a time capsule to past and future disasters and sets out to prevent the ultimate catastrophe.,2009,Summit Entertainment,50000000.0,24604751.0,79957634,103700864,183658498,2007/5/16,2 hr 1 min,PG-13,121
926,926,50000000.0,Animation Comedy Family,8920,competition moderator lasagne garfield,en,Garfield,17.667826,"Twentieth Century Fox Film Corporation, Davis Entertainment, Twentieth Century Fox Animation",United States of America,2004-06-10,200804534,80.0,English,Released,Get ready for frisky business.,garfield,5.2,820,Bill Murray Breckin Meyer Jennifer Love Hewitt Stephen Tobolowsky Evan Arnold,Peter Hewitt,954,Color,Peter Hewitt,116.0,80.0,12.0,58.0,Mark Christopher Lawrence,13000.0,75367693.0,Bill Murray,58961,13430,Michael Monks,0.0,232.0,English,USA,PG,35000000.0,2004.0,258.0,5.0,1.85,795,"Animation,Comedy,Family,Fantasy",880,"Adventure,Animation,Comedy,Family,Fantasy",80.0,880,"Jon Arbuckle buys a second pet, a dog named Odie. However, Odie is then abducted and it is up to Jon's cat, Garfield, to find and rescue the canine.",2004,Twentieth Century Fox,50000000.0,21727611.0,75369589,127802828,203172417,2004/6/11,1 hr 20 min,PG,80
929,929,50000000.0,Action Drama Science Fiction Thriller,6950,river general research army serum,en,Outbreak,30.397496000000004,"Kopelson Entertainment, Punch Productions, Warner Bros., Arnold Kopelson Productions",United States of America,1995-03-10,189859560,127.0,"English, 한국어/조선말, Français",Released,This animal carries a deadly virus... and the greatest medical crisis in the world is about to happen.,outbreak,6.3,513,Dustin Hoffman Rene Russo Morgan Freeman Kevin Spacey Cuba Gooding Jr.,Wolfgang Petersen,957,Color,Wolfgang Petersen,64.0,127.0,249.0,808.0,Morgan Freeman,18000.0,67823573.0,Kevin Spacey,91176,30383,Rene Russo,3.0,130.0,English,USA,R,50000000.0,1995.0,11000.0,6.6,1.85,0,"Action,Drama,Thriller",938,"Action,Horror,Sci-Fi,Thriller",112.0,938,Army doctors struggle to find a cure for a deadly virus spreading throughout a California town that was brought to America by an African monkey.,1995,Warner Bros.,85000000.0,13420387.0,67659560,122200000,189859560,2000/8/4,1 hr 52 min,R,112
930,930,50000000.0,Action Thriller Mystery,225574,airplane conspiracy airplane crash cell phone hijack,en,Non-Stop,83.295796,"StudioCanal, Silver Pictures, TF1 Films Production, Canal+, Anton Capital Entertainment (ACE), TF1, LOVEFiLM International","France, United Kingdom, United States of America",2014-01-26,222809600,106.0,"English, Deutsch",Released,The hijacking was just the beginning.,non-stop,6.8,2268,Liam Neeson Julianne Moore Scoot McNairy Michelle Dockery Nate Parker,Jaume Collet-Serra,958,Color,Jaume Collet-Serra,359.0,106.0,174.0,660.0,Nate Parker,14000.0,91439400.0,Liam Neeson,200647,16967,Scoot McNairy,0.0,384.0,English,UK,PG-13,50000000.0,2014.0,664.0,7.0,2.35,24000,"Action,Mystery,Thriller",768,"Action,Mystery,Thriller",106.0,768,"An air marshal springs into action during a transatlantic flight after receiving a series of text messages demanding $150 million into an off-shore account, or someone will die every 20 minutes.",2014,Universal Pictures,50000000.0,28875635.0,92168600,130641000,222809600,2014/2/19,1 hr 46 min,PG-13,106
937,937,50000000.0,Fantasy Horror Action,60304,witch black magic steampunk good vs evil troll,en,Hansel & Gretel: Witch Hunters,53.02786999999999,"Paramount Pictures, Studio Babelsberg, MTV Films, Gary Sanchez Productions, Metro-Goldwyn-Mayer (MGM), Deutsche Filmförderfonds (DFFF)","United States of America, Germany",2013-01-17,224803475,88.0,English,Released,Classic tale. New twist.,hansel & gretel: witch hunters,5.7,3239,Jeremy Renner Gemma Arterton Famke Janssen Pihla Viitala Derek Mears,Tommy Wirkola,966,Color,Tommy Wirkola,349.0,98.0,75.0,467.0,Derek Mears,10000.0,55682070.0,Jeremy Renner,159868,11946,Ingrid Bolsø Berdal,2.0,304.0,English,Germany,R,50000000.0,2013.0,520.0,6.1,2.35,45000,"Action,Fantasy,Horror",756,"Action,Fantasy,Horror",88.0,756,Brother/sister duo Hansel and Gretel are professional witch-hunters who help innocent villagers. One day they stumble upon a case that could hold the key to their past.,2013,Paramount Pictures,50000000.0,19690956.0,55703475,170646274,226349749,2013/1/17,1 hr 28 min,R,88
949,949,50000000.0,Comedy,71552,wife husband relationship sequel family reunion masturbation scat,en,American Reunion,39.920035,Universal Pictures,United States of America,2012-04-04,234989584,113.0,English,Released,Save the best piece for last.,american reunion,6.1,1611,Jason Biggs Alyson Hannigan Seann William Scott Chris Klein Thomas Ian Nicholas,Jon Hurwitz,978,Color,Jon Hurwitz,291.0,113.0,22.0,1000.0,Dania Ramirez,3000.0,56724080.0,Alyson Hannigan,172112,8398,Natasha Lyonne,7.0,181.0,English,USA,R,50000000.0,2012.0,1000.0,6.7,1.85,39000,Comedy,722,Comedy,113.0,722,"Jim, Michelle, Stifler, and their friends reunite in East Great Falls, Michigan for their high school reunion.",2012,Universal Pictures,50000000.0,21514080.0,57011521,177978063,234989584,2012/4/4,1 hr 53 min,R,113
