366,366,95000000.0,Action Science Fiction Thriller,9383,killing human experimentation scientist invisible man science experiment,en,Hollow Man,28.200874,"Columbia Pictures Corporation, Global Entertainment Productions GmbH & Company Medien KG","Germany, United States of America",2000-08-04,190213455,112.0,English,Released,What would you do if you knew you couldn't be seen?,hollow man,5.6,634,Kevin Bacon Elisabeth Shue Josh Brolin Kim Dickens Rhona Mitra,Paul Verhoeven,376,Color,Paul Verhoeven,180.0,119.0,719.0,423.0,Kim Dickens,833.0,73209340.0,Greg Grunberg,101834,2356,Joey Slotnick,0.0,628.0,English,USA,R,95000000.0,2000.0,624.0,5.7,1.85,0,"Action,Horror,Sci-Fi,Thriller",937,"Action,Horror,Sci-Fi,Thriller",112.0,937,"A brilliant scientist's discovery renders him invisible, but transforms him into an omnipotent, dangerous megalomaniac.",2000,Sony Pictures Entertainment (SPE),95000000.0,26414386.0,73209340,117004115,190213455,2000/8/4,1 hr 52 min,R,112
368,368,90000000.0,Adventure Family Fantasy,76285,poison hermes poseidon demigod golden fleece,en,Percy Jackson: Sea of Monsters,40.262260999999995,"1492 Pictures, Dune Entertainment, Fox 2000 Pictures, Sunswept Entertainment, Dune Entertainment III, TSG Entertainment",United States of America,2013-08-07,174578751,106.0,English,Released,"Where There Are Gods, There Are Monsters.",percy jackson: sea of monsters,5.9,1648,Logan Lerman Alexandra Daddario Douglas Smith Leven Rambin Brandon T. Jackson,Thor Freudenthal,378,Color,Thor Freudenthal,183.0,106.0,87.0,918.0,Leven Rambin,8000.0,68558662.0,Logan Lerman,86627,10882,Brandon T. Jackson,0.0,204.0,English,USA,PG,90000000.0,2013.0,956.0,5.9,2.35,28000,"Adventure,Family,Fantasy",890,"Adventure,Family,Fantasy",106.0,890,"In order to restore their dying safe haven, the son of Poseidon and his friends embark on a quest to the Sea of Monsters, to find the mythical Golden Fleece, all the while trying to stop an ancient evil from rising.",2013,Twentieth Century Fox,90000000.0,14401054.0,68559554,131290761,199850315,2013/8/7,1 hr 46 min,PG,106
370,370,90000000.0,Action Adventure Comedy Crime Mystery,291805,london england china magic secret society vigilante,en,Now You See Me 2,51.535701,"Summit Entertainment, Lionsgate, K/O Paper Products, TIK Films","Canada, China, United Kingdom, United States of America",2016-06-02,334901337,129.0,"普通话, English",Released,You Haven't Seen Anything Yet,now you see me 2,6.7,3235,Jesse Eisenberg Woody Harrelson Mark Ruffalo Dave Franco Morgan Freeman,Jon M. Chu,380,Color,Jon M. Chu,196.0,129.0,209.0,886.0,Morgan Freeman,11000.0,64685359.0,Daniel Radcliffe,40862,23031,Sanaa Lathan,6.0,139.0,English,USA,PG-13,90000000.0,2016.0,11000.0,6.9,2.35,15000,"Action,Adventure,Comedy,Crime,Mystery,Thriller",466,"Action,Adventure,Fantasy,Thriller",103.0,466,"The Four Horsemen resurface, and are forcibly recruited by a tech genius to pull off their most impossible heist yet.",2016,Lionsgate,85000000.0,22383146.0,65075540,269822066,334897606,2016/12/16,1 hr 43 min,PG-13,103
374,374,90000000.0,Animation Adventure Comedy Family,46195,brazil pet bird musical canary,en,Rio,46.200042,"Blue Sky Studios, Twentieth Century Fox Animation",United States of America,2011-04-03,484635760,96.0,"English, Português",Released,1 out of every 8 Americans is afraid of flying. Most of them don't have feathers.,rio,6.5,2166,Jesse Eisenberg Anne Hathaway Leslie Mann Jane Lynch Will.i.am,Carlos Saldanha,384,Color,Carlos Saldanha,240.0,96.0,107.0,350.0,Wanda Sykes,11000.0,143618384.0,Anne Hathaway,165333,12071,Will.i.am,0.0,186.0,English,USA,G,90000000.0,2011.0,560.0,7.0,2.35,19000,"Adventure,Animation,Comedy,Family,Musical",253,"Adventure,Animation,Comedy,Family,Music,Musical",96.0,253,"When Blu, a domesticated macaw from small-town Minnesota, meets the fiercely independent Jewel, he takes off on an adventure to Rio de Janeiro with the bird of his dreams.",2011,Twentieth Century Fox,90000000.0,39225962.0,143619809,340246963,483866772,2011/4/4,1 hr 36 min,PG,96
383,383,92000000.0,Action Adventure Drama,664,wife husband relationship tornado twister oklahoma metereologist,en,Twister,32.079995000000004,"Universal Pictures, Amblin Entertainment, Warner Bros., Constant c Productions",United States of America,1996-05-10,494471524,113.0,English,Released,The Dark Side of Nature.,twister,6.1,950,Helen Hunt Bill Paxton Cary Elwes Jami Gertz Philip Seymour Hoffman,Jan de Bont,394,Color,Jan de Bont,114.0,113.0,101.0,848.0,Alan Ruck,22000.0,241688385.0,Philip Seymour Hoffman,144053,26239,Jami Gertz,0.0,395.0,English,USA,PG-13,92000000.0,1996.0,946.0,6.3,2.35,0,"Action,Adventure,Drama,Thriller",241,"Action,Adventure,Thriller",113.0,241,"Bill and Jo Harding, advanced storm chasers on the brink of divorce, must join together to create an advanced weather alert system by putting themselves in the cross-hairs of extremely violent tornadoes.",1996,Warner Bros.,92000000.0,41059405.0,241830615,252750000,494580615,1996/5/10,1 hr 53 min,,113
384,384,90000000.0,Adventure Drama,8358,exotic island suicide attempt volleyball loneliness airplane crash,en,Cast Away,57.739713,"DreamWorks SKG, Twentieth Century Fox Film Corporation, Playtone, ImageMovers",United States of America,2000-12-22,429632142,143.0,"Pусский, English",Released,"At the edge of the world, his journey begins.",cast away,7.5,3218,Tom Hanks Helen Hunt Chris Noth Paul Sanchez Lari White,Robert Zemeckis,396,Color,Robert Zemeckis,221.0,143.0,0.0,272.0,Paul Sanchez,15000.0,233630478.0,Tom Hanks,394317,15838,Nick Searcy,1.0,1051.0,English,USA,PG-13,90000000.0,2000.0,410.0,7.7,1.85,23000,"Adventure,Drama,Romance",308,"Adventure,Drama,Romance",143.0,308,A FedEx executive undergoes a physical and emotional transformation after crash landing on a deserted island.,2000,Twentieth Century Fox,90000000.0,28883406.0,233632142,196000000,429632142,2000/12/22,2 hr 23 min,PG-13,143
385,385,100000000.0,Animation Comedy,9836,ocean fish zoo penguin tap dancing,en,Happy Feet,37.272385,"Kennedy Miller Productions, Animal Logic",Australia,2006-11-16,384335608,108.0,English,Released,WARNING: May Cause Toe-Tapping.,happy feet,5.9,1410,Elijah Wood Robin Williams Brittany Murphy Hugh Jackman Nicole Kidman,George Miller,397,Color,George Miller,206.0,108.0,750.0,971.0,Hugh Jackman,49000.0,197992827.0,Robin Williams,132501,70996,Elizabeth Daily,0.0,548.0,English,USA,PG,100000000.0,2006.0,20000.0,6.5,2.35,0,"Animation,Comedy,Family,Music,Romance",366,"Adventure,Animation,Comedy,Family,Music,Musical,Romance",108.0,366,"Into the world of the Emperor Penguins, who find their soul mates through song, a penguin is born who cannot sing. But he can tap dance something fierce!",2006,Warner Bros.,100000000.0,41533432.0,198000317,186335791,384336108,2006/11/17,1 hr 48 min,PG,108
386,386,75000000.0,Action Drama Thriller,2502,berlin assassin based on novel amnesia sniper,en,The Bourne Supremacy,53.213931,"Universal Pictures, The Kennedy/Marshall Company, Hypnotic, Motion Picture THETA Produktionsgesellschaft, Ludlum Entertainment","Germany, United States of America",2004-07-23,288500217,108.0,"English, Pусский, Deutsch, Italiano",Released,They should have left him alone.,the bourne supremacy,7.2,2825,Matt Damon Franka Potente Brian Cox Julia Stiles Karl Urban,Paul Greengrass,398,Color,Paul Greengrass,239.0,108.0,521.0,129.0,Joan Allen,13000.0,176049130.0,Matt Damon,348232,14161,Oksana Akinshina,1.0,806.0,English,USA,PG-13,75000000.0,2004.0,805.0,7.8,2.35,0,"Action,Mystery,Thriller",568,"Action,Mystery,Thriller",108.0,568,"When Jason Bourne is framed for a CIA operation gone awry, he is forced to resume his former life as a trained assassin to survive.",2004,Universal Pictures,75000000.0,52521865.0,176241941,114593328,290835269,2004/7/23,1 hr 48 min,PG-13,108
387,387,85000000.0,Action Thriller,9772,prison corruption journalist white house hostage,en,Air Force One,36.38795,"Columbia Pictures Corporation, Beacon Communications, Radiant Productions","Germany, United States of America",1997-07-25,315156409,124.0,"English, Pусский",Released,The fate of a nation rests on the courage of one man.,air force one,6.2,840,Harrison Ford Gary Oldman Glenn Close Wendy Crewson William H. Macy,Wolfgang Petersen,399,Color,Wolfgang Petersen,142.0,124.0,249.0,936.0,Gary Oldman,11000.0,172620724.0,Harrison Ford,146134,23603,Dean Stockwell,1.0,393.0,English,USA,R,85000000.0,1997.0,10000.0,6.4,2.35,0,"Action,Adventure,Drama,Thriller",505,"Action,Drama,Thriller",124.0,505,"Communist radicals hijack Air Force One with the U.S. President and his family on board. The Vice President negotiates from Washington D.C., while the President, a veteran, fights to rescue the hostages on board.",1997,Sony Pictures Entertainment (SPE),85000000.0,37132505.0,172956409,142200000,315156409,1997/7/25,2 hr 4 min,R,124
388,388,85000000.0,Thriller Crime,161,prison pickpocket strip club con artist atlantic city,en,Ocean's Eleven,60.929352,"Village Roadshow Pictures, Section Eight, NPV Entertainment, Jerry Weintraub Productions, Warner Bros., WV Films II",United States of America,2001-12-07,450717150,116.0,"Italiano, English",Released,Are you in or out?,ocean's eleven,7.2,3783,George Clooney Brad Pitt Matt Damon Andy Garc\u00eda Julia Roberts,Steven Soderbergh,400,Color,Steven Soderbergh,186.0,116.0,0.0,471.0,Bernie Mac,11000.0,183405771.0,Brad Pitt,402645,13028,Elliott Gould,4.0,845.0,English,USA,PG-13,85000000.0,2001.0,1000.0,7.8,2.35,0,"Crime,Thriller",286,"Crime,Thriller",116.0,286,Danny Ocean and his ten accomplices plan to rob three Las Vegas casinos simultaneously.,2001,Warner Bros.,85000000.0,38107822.0,183417150,267300000,450717150,2001/12/7,1 hr 56 min,PG-13,116
390,390,85000000.0,Animation Comedy Family Fantasy,76492,witch magic mummy vampire dracula,en,Hotel Transylvania,56.257411,"Columbia Pictures, Sony Pictures Animation",United States of America,2012-09-20,358375603,91.0,English,Released,Where monsters go to get away from it all,hotel transylvania,6.8,2566,Adam Sandler Steve Buscemi David Spade Kevin James Selena Gomez,Genndy Tartakovsky,402,Color,Genndy Tartakovsky,256.0,91.0,266.0,11000.0,Adam Sandler,12000.0,148313048.0,Steve Buscemi,164148,37142,Jon Lovitz,2.0,168.0,English,USA,PG,85000000.0,2012.0,11000.0,7.1,1.85,28000,"Animation,Comedy,Family,Fantasy",418,"Adventure,Animation,Comedy,Family,Fantasy,Horror,Romance",91.0,418,"Dracula, who operates a high-end resort away from the human world, goes into overprotective mode when a boy discovers the resort and falls for the count's teenaged daughter.",2012,Sony Pictures Entertainment (SPE),85000000.0,42522194.0,148313048,210062555,358375603,2012/9/20,1 hr 31 min,PG,91
391,391,85000000.0,Comedy Family Fantasy Romance,4523,poison queen fairy tale musical princess,en,Enchanted,29.21998,"Walt Disney Pictures, Josephson Entertainment, Andalasia Productions, Right Coast Productions",United States of America,2007-11-20,340487652,107.0,English,Released,This fairytale princess is about to meet a real Prince Charming,enchanted,6.6,1449,Amy Adams Patrick Dempsey James Marsden Timothy Spall Rachel Covey,Kevin Lima,403,Color,Kevin Lima,222.0,107.0,36.0,118.0,Teala Dunn,283.0,127706877.0,Jeff Bennett,142496,662,Fred Tatasciore,2.0,399.0,English,USA,PG,85000000.0,2007.0,142.0,7.1,2.35,0,"Animation,Comedy,Family,Fantasy,Musical,Romance",457,"Adventure,Animation,Comedy,Family,Fantasy,Musical,Romance",107.0,457,"A young maiden in a land called Andalasia, who is prepared to be wed, is sent away to New York City by an evil Queen, where she falls in love with a lawyer.",2007,Walt Disney Studios Motion Pictures,85000000.0,34440317.0,127807262,212680600,340487862,2007/11/21,1 hr 47 min,PG,107
392,392,85000000.0,Action Thriller,59961,cia violence safe house rogue agent cape town south africa,en,Safe House,34.773106,"Universal Pictures, Dentsu, Relativity Media, Bluegrass Films",United States of America,2012-02-09,208076205,115.0,"English, Afrikaans, Español",Released,No one is safe,safe house,6.3,1345,Denzel Washington Ryan Reynolds Vera Farmiga Joel Kinnaman Brendan Gleeson,Daniel Espinosa,405,Color,Daniel Espinosa,298.0,115.0,79.0,820.0,Ryan Reynolds,18000.0,126149655.0,Denzel Washington,166693,36237,Sam Shepard,1.0,276.0,English,USA,R,85000000.0,2012.0,16000.0,6.8,2.35,19000,"Action,Crime,Mystery,Thriller",846,"Action,Thriller",115.0,846,"A young CIA agent is tasked with looking after a fugitive in a safe house. But when the safe house is attacked, he finds himself on the run with his charge.",2012,Universal Pictures,85000000.0,40172720.0,126373434,81702771,208076205,2012/2/8,1 hr 55 min,R,115
393,393,85000000.0,Comedy Family,10481,london england prison release from prison women's prison society for the prevention of cruelty to animals,en,102 Dalmatians,9.895061,"Walt Disney Pictures, Cruella Productions",United States of America,2000-10-07,183611771,100.0,English,Released,Meet Two Unlikely Heroes With A Bone To Pick.,102 dalmatians,5.1,313,Glenn Close Ioan Gruffudd Alice Evans Tim McInnerny G\u00e9rard Depardieu,Kevin Lima,406,Color,Kevin Lima,84.0,100.0,36.0,439.0,Eric Idle,2000.0,66941559.0,Ioan Gruffudd,26413,4182,Jim Carter,1.0,77.0,English,USA,G,85000000.0,2000.0,795.0,4.8,1.85,372,"Adventure,Comedy,Family",972,"Adventure,Comedy,Family",100.0,972,Cruella DeVil gets out of prison and goes after the puppies once more.,2000,Walt Disney Studios Motion Pictures,85000000.0,19883351.0,66957026,116654745,183611771,2000/11/22,1 hr 40 min,,100
395,395,85000000.0,Comedy Romance,1581,holiday london england film making christmas party country house,en,The Holiday,44.967453000000006,"Columbia Pictures, Universal Pictures, Waverly Films, Relativity Media","United Kingdom, United States of America",2006-12-08,194168700,136.0,English,Released,It's Christmas Eve and we are going to go celebrate being young and being alive.,the holiday,6.7,1225,Cameron Diaz Kate Winslet Jude Law Jack Black Eli Wallach,Nancy Meyers,408,Color,Nancy Meyers,157.0,138.0,278.0,213.0,Rufus Sewell,14000.0,63224849.0,Kate Winslet,182757,17423,Sarah Parish,3.0,483.0,English,USA,PG-13,85000000.0,2006.0,3000.0,6.9,1.85,19000,"Comedy,Romance",855,"Comedy,Romance",136.0,855,"Two women troubled with guy-problems swap homes in each other's countries, where they each meet a local guy and fall in love.",2006,Sony Pictures Entertainment (SPE),85000000.0,12778913.0,63224849,142625320,205850169,2006/12/5,2 hr 16 min,PG-13,136
396,396,90000000.0,Action Drama Thriller,9798,corruption washington d.c. helicopter falsely accused identity,en,Enemy of the State,41.207568,"Jerry Bruckheimer Films, Scott Free Productions, Touchstone Pictures, No Such Productions",United States of America,1998-11-20,250649836,132.0,English,Released,It's not paranoia if they're really after you.,enemy of the state,6.7,1240,Will Smith Gene Hackman Jon Voight Regina King Ian Hart,Tony Scott,409,Color,Tony Scott,81.0,140.0,12000.0,619.0,Jake Busey,10000.0,111544445.0,Will Smith,188116,11951,Lisa Bonet,4.0,415.0,English,USA,R,90000000.0,1998.0,660.0,7.3,2.35,0,"Action,Crime,Drama,Mystery,Thriller",663,"Action,Thriller",132.0,663,A lawyer becomes targeted by a corrupt politician and his N.S.A. goons when he accidentally receives key evidence to a politically motivated crime.,1998,Walt Disney Studios Motion Pictures,90000000.0,20038573.0,111549836,139299953,250849789,1998/11/20,2 hr 12 min,R,132
397,397,85000000.0,Comedy Romance,22897,graduation ex husband woman director,en,It's Complicated,16.479851,"Universal Pictures, Scott Rudin Productions, Waverly Films, Dentsu, Relativity Media",United States of America,2009-12-23,219103655,121.0,"English, Français",Released,First comes marriage. Then comes divorce. And then...,it's complicated,6.2,360,Meryl Streep Alec Baldwin Steve Martin John Krasinski Lake Bell,Nancy Meyers,410,Color,Nancy Meyers,187.0,120.0,278.0,963.0,Hunter Parrish,11000.0,112703470.0,Meryl Streep,69860,15226,Zoe Kazan,2.0,214.0,English,USA,R,85000000.0,2009.0,2000.0,6.6,1.85,0,"Comedy,Drama,Romance",782,"Comedy,Drama,Romance",121.0,782,"When attending their son's college graduation, a couple reignite the spark in their relationship. But the complicated fact is they're divorced and he's remarried.",2009,Universal Pictures,85000000.0,22100820.0,112735375,106368280,219103655,2009/12/23,2 hr 1 min,R,121
398,398,85000000.0,Crime Thriller,298,casino thief revenge heist las vegas,en,Ocean's Thirteen,42.069993,"Village Roadshow Pictures, Section Eight, Jerry Weintraub Productions, Warner Bros.",United States of America,2007-06-07,311312624,122.0,"Español, English, Français",Released,What are the odds of getting even? 13 to one.,ocean's thirteen,6.5,1999,George Clooney Brad Pitt Matt Damon Al Pacino Bernie Mac,Steven Soderbergh,411,Color,Steven Soderbergh,238.0,122.0,0.0,11000.0,Matt Damon,14000.0,117144465.0,Al Pacino,256928,43499,Brad Pitt,3.0,288.0,English,USA,PG-13,85000000.0,2007.0,13000.0,6.9,2.35,0,"Crime,Thriller",515,"Action,Adventure,Animation,Comedy,Family,Fantasy,Sci-Fi",104.0,515,"Danny Ocean rounds up the boys for a third heist after casino owner Willy Bank double-crosses one of the original eleven, Reuben Tishkoff.",2007,Warner Bros.,85000000.0,36133403.0,117154724,194157900,311312624,2017/2/2,1 hr 44 min,PG,104
399,399,85000000.0,Adventure Animation Family,7484,hunter mountains garage grizzly bear bunny,en,Open Season,26.61951,Sony Pictures Animation,United States of America,2006-09-29,197309027,83.0,English,Released,One Fur All & All Fur One,open season,6.1,656,Martin Lawrence Ashton Kutcher Gary Sinise Debra Messing Billy Connolly,Jill Culton,412,Color,Roger Allers,107.0,83.0,28.0,624.0,Debra Messing,4000.0,84303558.0,Jon Favreau,65270,6081,Jane Krakowski,1.0,100.0,English,USA,PG,85000000.0,2006.0,650.0,6.2,1.85,863,"Adventure,Animation,Comedy,Family",887,"Adventure,Animation,Comedy,Family",86.0,887,"Boog, a domesticated 900lb. Grizzly bear, finds himself stranded in the woods 3 days before Open Season. Forced to rely on Elliot, a fast-talking mule deer, the two form an unlikely friendship and must quickly rally other forest animals if they are to form a rag-tag army against the hunters.",2006,Sony Pictures Entertainment (SPE),85000000.0,23624548.0,85105259,115706430,200811689,2006/9/29,1 hr 26 min,PG,86
400,400,85000000.0,Adventure Action Science Fiction,157350,based on novel dystopia youth dystopic future caste system,en,Divergent,80.316463,"Summit Entertainment, Red Wagon Entertainment",United States of America,2014-03-14,288747895,139.0,English,Released,What makes you different makes you dangerous.,divergent,6.9,4663,Shailene Woodley Theo James Kate Winslet Miles Teller Ray Stevenson,Neil Burger,413,Color,Neil Burger,459.0,139.0,168.0,1000.0,Theo James,14000.0,150832203.0,Kate Winslet,341058,22226,Mekhi Phifer,2.0,713.0,English,USA,PG-13,85000000.0,2014.0,5000.0,6.7,2.35,49000,"Adventure,Mystery,Sci-Fi",571,"Action,Adventure,Mystery,Sci-Fi",139.0,571,"In a world divided by factions based on virtues, Tris learns she's Divergent and won't fit in. When she discovers a plot to destroy Divergents, Tris and the mysterious Four must find out what makes Divergents dangerous before it's too late.",2014,Lionsgate,85000000.0,54607747.0,150947895,137937923,288885818,2014/3/20,2 hr 19 min,PG-13,139
410,410,85000000.0,Adventure Fantasy Drama Comedy Science Fiction,62764,attempted murder fairy tale black magic cockroach villainess,en,Mirror Mirror,48.126296999999994,"Relativity Media, Misher Films, Yucaipa Films, Goldmann Pictures, Rat Entertainment, Misha Films",United States of America,2012-03-15,183018522,106.0,English,Released,The Snow White legend comes alive.,mirror mirror,5.5,1114,Julia Roberts Lily Collins Armie Hammer Nathan Lane Martin Klebba,Tarsem Singh,423,Color,Tarsem Singh,382.0,106.0,763.0,809.0,Nathan Lane,8000.0,64933670.0,Julia Roberts,70838,11454,Danny Woodburn,1.0,208.0,English,USA,PG,85000000.0,2012.0,886.0,5.6,1.85,18000,"Adventure,Comedy,Drama,Family,Fantasy",979,"Adventure,Comedy,Drama,Family,Fantasy",106.0,979,An evil queen steals control of a kingdom and an exiled princess enlists the help of seven resourceful rebels to win back her birthright.,2012,Relativity Media,85000000.0,18132085.0,64935167,118083355,183018522,2012/3/15,1 hr 46 min,PG,106
414,414,84000000.0,Mystery Adventure Comedy,9637,amateur detective voodoo resort crime solving,en,Scooby-Doo,31.435539,"Atlas Entertainment, Mosaic Media Group, Warner Bros.",United States of America,2002-06-14,275650703,88.0,English,Released,Get a Clue,scooby-doo,5.4,820,Freddie Prinze Jr. Sarah Michelle Gellar Matthew Lillard Linda Cardellini Rowan Atkinson,Raja Gosnell,427,Color,Raja Gosnell,138.0,86.0,67.0,271.0,Linda Cardellini,4000.0,153288182.0,Sarah Michelle Gellar,71424,6355,Miguel A. Núñez Jr.,3.0,521.0,English,USA,PG,84000000.0,2002.0,2000.0,4.9,1.85,0,"Adventure,Comedy,Mystery",592,"Adventure,Comedy,Family,Fantasy,Mystery",89.0,592,"After an acrimonious break up, the Mystery Inc. gang are individually brought to an island resort to investigate strange goings on.",2002,Warner Bros.,84000000.0,54155312.0,153322074,122356539,275678613,2002/6/14,1 hr 29 min,PG,89
416,416,82500000.0,Comedy Drama Fantasy Romance,9339,regret workaholic heart attack architect dying and death,en,Click,41.176631,"Original Film, Columbia Pictures Corporation, Revolution Studios, Happy Madison Productions",United States of America,2006-06-22,237681299,107.0,"English, Português, 日本語",Released,What If You Had A Remote... That Controlled Your Universe?,click,6.0,2104,Adam Sandler Kate Beckinsale Christopher Walken David Hasselhoff Henry Winkler,Frank Coraci,429,Color,Frank Coraci,173.0,107.0,153.0,233.0,Cameron Monaghan,11000.0,137340146.0,Adam Sandler,246492,12700,Julie Kavner,1.0,685.0,English,USA,PG-13,70000000.0,2006.0,1000.0,6.4,1.85,7000,"Comedy,Drama,Fantasy,Romance",702,"Comedy,Drama,Fantasy,Romance",107.0,702,A workaholic architect finds a universal remote that allows him to fast-forward and rewind to different parts of his life. Complications arise when the remote starts to overrule his choices.,2006,Revolution Studios,82500000.0,40011365.0,137355633,103329693,240685326,2006/6/22,1 hr 47 min,PG-13,107
419,419,85000000.0,Adventure Fantasy Science Fiction,8247,adolescence based on novel loss of child fight chase,en,Jumper,21.218000000000004,"Dune Entertainment, Hypnotic, New Regency Pictures","Canada, United States of America",2008-02-10,222231186,88.0,Français,Released,anywhere is possible.,jumper,5.9,1799,Hayden Christensen Jamie Bell Samuel L. Jackson Rachel Bilson Michael Rooker,Doug Liman,432,Color,Doug Liman,238.0,88.0,218.0,521.0,Hayden Christensen,17000.0,80170146.0,Kristen Stewart,243053,21863,Tom Hulce,0.0,488.0,English,USA,PG-13,85000000.0,2008.0,4000.0,6.1,2.35,0,"Action,Adventure,Sci-Fi,Thriller",761,"Action,Adventure,Sci-Fi,Thriller",88.0,761,A teenager with teleportation abilities suddenly finds himself in the middle of an ancient war between those like him and their sworn annihilators.,2008,Twentieth Century Fox,85000000.0,27354808.0,80172128,144959985,225132113,2008/2/13,1 hr 28 min,PG-13,88
423,423,80000000.0,Fantasy Comedy,310,christianity moon responsability moses street gang,en,Bruce Almighty,109.68478799999998,"Universal Pictures, Spyglass Entertainment, Shady Acres Entertainment, Pit Bull Productions",United States of America,2003-05-23,484572835,101.0,English,Released,In Bruce we trust,bruce almighty,6.4,3012,Jim Carrey Jennifer Aniston Philip Baker Hall Catherine Bell Lisa Ann Walter,Tom Shadyac,436,Color,Tom Shadyac,191.0,101.0,293.0,1000.0,Steve Carell,11000.0,242589580.0,Morgan Freeman,296904,21276,Lisa Ann Walter,1.0,604.0,English,USA,PG-13,81000000.0,2003.0,7000.0,6.7,1.85,0,"Comedy,Drama",251,"Comedy,Fantasy",101.0,251,A whiny news reporter is given the chance to step into God's shoes.,2003,Universal Pictures,81000000.0,67953330.0,242829261,241763613,484592874,2003/5/23,1 hr 41 min,PG-13,101
424,424,80000000.0,Thriller Adventure Action,27578,tattoo martial arts sniper island mercenary,en,The Expendables,77.58066099999998,Millennium Films,United States of America,2010-08-03,274470394,103.0,"English, Español",Released,Choose Your Weapon.,the expendables,6.0,2926,Sylvester Stallone Jason Statham Dolph Lundgren Eric Roberts Randy Couture,Sylvester Stallone,437,Color,Sylvester Stallone,424.0,113.0,13000.0,5000.0,Sylvester Stallone,26000.0,102981571.0,Jason Statham,270226,46355,Jet Li,9.0,741.0,English,USA,R,80000000.0,2010.0,13000.0,6.5,2.35,57000,"Action,Adventure,Thriller",597,"Action,Adventure,Thriller",103.0,597,A CIA operative hires a team of mercenaries to eliminate a Latin dictator and a renegade CIA agent.,2010,Lionsgate,80000000.0,34825135.0,103068524,171401870,274470394,2010/8/12,1 hr 43 min,R,103
425,425,80000000.0,Adventure Action Thriller,954,paris london england spy cia terrorist,en,Mission: Impossible,75.290998,"Paramount Pictures, Cruise/Wagner Productions",United States of America,1996-05-22,457696359,110.0,"English, Français, Český",Released,Expect the Impossible.,mission: impossible,6.7,2631,Tom Cruise Jon Voight Emmanuelle B\u00e9art Henry Czerny Jean Reno,Brian De Palma,438,Color,Brian De Palma,154.0,110.0,0.0,898.0,Kristin Scott Thomas,10000.0,180965237.0,Tom Cruise,300542,12760,Vanessa Redgrave,0.0,378.0,English,USA,PG-13,80000000.0,1996.0,1000.0,7.1,2.35,0,"Action,Adventure,Thriller",281,"Action,Adventure,Thriller",110.0,281,"An American agent, under false suspicion of disloyalty, must discover and expose the real spy without the help of his organization.",1996,Paramount Pictures,80000000.0,45436830.0,180981856,276714535,457696391,1996/5/22,1 hr 50 min,PG-13,110
